provider,id,description,package,title,name,level,risk-level,security,reliability,performance-efficiency,cost-optimisation,operational-excellence,release-date,update-date,knowledge-base-html,multi-risk-level,must-be-configured,not-scored,categories
azure,StorageAccounts-014,"Ensure that the access to your Microsoft Azure Storage blobs, files, tables and queues is limited only to specific (trusted) public IP address and/or IP address range",base,Limit Storage Account Access by IP Address,LimitAccessByIPAddress,resource,MEDIUM,YES,NO,NO,NO,NO,2020-09-21,2017-01-01,https://www.cloudconformity.com/knowledge-base/azure/StorageAccounts/limit-access-by-ip-address.html,,True,,
azure,StorageAccounts-015,Ensure that Azure Storage shared access signature (SAS) tokens are not using overly permissive access policies (Not Scored),base,Check for Overly Permissive Stored Access Policies,CheckForOverlyPermissiveStoredAccessPolicies,account,HIGH,YES,NO,NO,NO,NO,2020-09-21,2017-01-01,https://www.cloudconformity.com/knowledge-base/azure/StorageAccounts/overly-permissive-stored-access-policy.html,,,True,
azure,StorageAccounts-016,Ensure that Azure Storage containers created to host static websites are not publicly accessible.,base,Check for Publicly Accessible Web Containers,CheckForPubliclyAccessibleWebContainers,resource,MEDIUM,YES,NO,NO,NO,NO,2020-10-14,2017-01-01,https://www.cloudconformity.com/knowledge-base/azure/StorageAccounts/publicly-accessible-web-containers.html,,,,
azure,StorageAccounts-017,Ensure that Azure Storage Accounts with static website configuration are regularly reviewed.,base,Review Storage Accounts with Static Website Configuration,StaticWebsiteConfiguration,resource,MEDIUM,YES,NO,NO,NO,NO,2020-11-30,2017-01-01,https://www.cloudconformity.com/knowledge-base/azure/StorageAccounts/review-static-website-configuration.html,,True,,
azure,SecurityCenter-001,Ensure that Security Center standard pricing tier is enabled,base,Enable Standard Pricing Tier,EnableStandardPricingTier,service,MEDIUM,YES,NO,NO,NO,NO,2019-10-09,2017-01-01,https://www.cloudconformity.com/knowledge-base/azure/SecurityCenter/pricing-tier.html,,,,
azure,SecurityCenter-002,Ensure that Automatic provisioning of monitoring agent is set to On,base,Automatic Provisioning Of The Monitoring Agent,AutomaticProvisioningOfTheMonitoringAgent,resource,MEDIUM,YES,NO,NO,NO,NO,2019-10-09,2017-01-01,https://www.cloudconformity.com/knowledge-base/azure/SecurityCenter/automatic-provisioning-of-monitoring-agent.html,,,,
azure,SecurityCenter-003,Ensure that System updates is not set to Disabled,base,Monitor System Updates,MonitorSystemUpdates,resource,MEDIUM,YES,NO,NO,NO,NO,2019-10-09,2017-01-01,https://www.cloudconformity.com/knowledge-base/azure/SecurityCenter/monitor-system-updates.html,,,,
azure,SecurityCenter-004,Ensure that Security Configurations is not set to Disabled,base,Monitor OS Vulnerabilities,MonitorOSVulnerabilities,resource,MEDIUM,YES,NO,NO,NO,NO,2019-10-09,2017-01-01,https://www.cloudconformity.com/knowledge-base/azure/SecurityCenter/monitor-os-vulnerabilities.html,,,,
azure,SecurityCenter-005,Ensure that Endpoint protection is not set to Disabled,base,Monitor Endpoint Protection,MonitorEndpointProtection,resource,MEDIUM,YES,NO,NO,NO,NO,2019-10-09,2017-01-01,https://www.cloudconformity.com/knowledge-base/azure/SecurityCenter/monitor-endpoint-protection.html,,,,
azure,SecurityCenter-006,Ensure that Disk Encryption is not set to Disabled,base,Monitor Disk Encryption,MonitorDiskEncryption,resource,MEDIUM,YES,NO,NO,NO,NO,2019-10-09,2017-01-01,https://www.cloudconformity.com/knowledge-base/azure/SecurityCenter/monitor-disk-encryption.html,,,,
azure,SecurityCenter-007,Ensure that Network Security Groups is not set to Disabled,base,Monitor Network Security Groups,MonitorNetworkSecurityGroups,resource,MEDIUM,YES,NO,NO,NO,NO,2019-10-09,2017-01-01,https://www.cloudconformity.com/knowledge-base/azure/SecurityCenter/monitor-network-security-groups.html,,,,
azure,SecurityCenter-008,Ensure that Web Application Firewall is not set to Disabled,base,Monitor Web Application Firewall,MonitorWebApplicationFirewall,resource,MEDIUM,YES,NO,NO,NO,NO,2019-10-09,2017-01-01,https://www.cloudconformity.com/knowledge-base/azure/SecurityCenter/monitor-web-application-firewall.html,,,,
azure,SecurityCenter-009,Ensure that Next generation firewall is not set to Disabled,base,Next Generation Firewall(NGFW) Monitoring,NextGenerationFirewallMonitoring,resource,MEDIUM,YES,NO,NO,NO,NO,2019-10-09,2017-01-01,https://www.cloudconformity.com/knowledge-base/azure/SecurityCenter/next-generation-firewall-monitoring.html,,,,
azure,SecurityCenter-010,Ensure that Vulnerability Assessment is not set to Disabled,base,Monitor Vulnerability Assessment,MonitorVulnerabilityAssessment,resource,MEDIUM,YES,NO,NO,NO,NO,2019-10-09,2017-01-01,https://www.cloudconformity.com/knowledge-base/azure/SecurityCenter/monitor-vulnerability-assessment.html,,,,
azure,SecurityCenter-011,Ensure that Storage Encryption is not set to Disabled,base,Monitor Storage Blob Encryption,MonitorStorageBlobEncryption,resource,MEDIUM,YES,NO,NO,NO,NO,2019-10-09,2017-01-01,https://www.cloudconformity.com/knowledge-base/azure/SecurityCenter/monitor-storage-blob-encryption.html,,,,
azure,SecurityCenter-012,Ensure that JIT Network Access is not set to Disabled,base,Monitor JIT Network Access,MonitorJITNetworkAccess,resource,HIGH,YES,NO,NO,NO,NO,2019-10-09,2017-01-01,https://www.cloudconformity.com/knowledge-base/azure/SecurityCenter/monitor-jit-network-access.html,,,,
azure,SecurityCenter-013,Ensure that Adaptive Application controls is not set to Disabled,base,Monitor Adaptive Application Safelisting,MonitorAdaptiveApplicationSafelisting,resource,MEDIUM,YES,NO,NO,NO,NO,2019-10-09,2017-01-01,https://www.cloudconformity.com/knowledge-base/azure/SecurityCenter/monitor-adaptive-application-safelisting.html,,,,
azure,SecurityCenter-014,Ensure that SQL Auditing is not set to Disabled,base,Monitor SQL Auditing,MonitorSQLAuditing,resource,MEDIUM,YES,NO,NO,NO,NO,2019-10-09,2017-01-01,https://www.cloudconformity.com/knowledge-base/azure/SecurityCenter/monitor-sql-auditing.html,,,,
azure,SecurityCenter-015,Ensure that SQL Encryption is not set to Disabled,base,Monitor SQL Encryption,MonitorSQLEncryption,resource,MEDIUM,YES,NO,NO,NO,NO,2019-10-09,2017-01-01,https://www.cloudconformity.com/knowledge-base/azure/SecurityCenter/monitor-sql-encryption.html,,,,
azure,SecurityCenter-016,Ensure that a valid security contact email address is set,base,Security Contact Emails,SecurityContactEmails,service,MEDIUM,YES,NO,NO,NO,NO,2019-10-09,2020-10-14,https://www.cloudconformity.com/knowledge-base/azure/SecurityCenter/security-contact-emails.html,,,,
azure,SecurityCenter-017,Ensure that a valid security contact phone number is set,base,Security Contact Phone Number,SecurityContactPhoneNumber,service,MEDIUM,YES,NO,NO,NO,NO,2019-10-09,2020-10-14,https://www.cloudconformity.com/knowledge-base/azure/SecurityCenter/security-contact-phone-number.html,,,,
azure,SecurityCenter-018,Ensure that Email Notification for Alerts is set to On,base,Email Notification for Alerts,EmailNotificationForAlerts,service,MEDIUM,YES,NO,NO,NO,NO,2019-10-09,2020-10-14,https://www.cloudconformity.com/knowledge-base/azure/SecurityCenter/email-notification-for-alerts.html,,,,
azure,SecurityCenter-019,Ensure that Send email also to subscription owners is set to On,base,Email To Subscription Owners,EmailToSubscriptionOwners,service,MEDIUM,YES,NO,NO,NO,NO,2019-10-09,2020-10-14,https://www.cloudconformity.com/knowledge-base/azure/SecurityCenter/email-to-subscription-owners.html,,,,
azure,SecurityCenter-020,All Active Microsoft Security Center Recommendations,base,Active Recommendations,ActiveRecommendations,resource,HIGH,YES,NO,NO,NO,NO,2020-08-19,2017-01-01,https://www.cloudconformity.com/knowledge-base/azure/SecurityCenter/security-center-recommendations.html,True,True,,
azure,SecurityCenter-021,Ensure that monitoring of deprecated accounts within your Azure subscription(s) is enabled,base,Enable Monitoring of Deprecated Accounts,ResourceHasValue,resource,MEDIUM,YES,NO,NO,NO,NO,2020-11-30,2017-01-01,https://www.cloudconformity.com/knowledge-base/azure/SecurityCenter/enable-deprecated-accounts-monitoring.html,,,,
azure,SecurityCenter-022,Ensure that the total number of subscription owners within your Azure account is monitored,base,Monitor the Total Number of Subscription Owners,ResourceHasValue,resource,MEDIUM,YES,NO,NO,NO,NO,2020-11-30,2017-01-01,https://www.cloudconformity.com/knowledge-base/azure/SecurityCenter/monitor-total-number-of-subscription-owners.html,,,,
azure,SecurityCenter-023,Ensure that IP forwarding enabled on your Azure virtual machines (VMs) is being monitored,base,Enable Virtual Machine IP Forwarding Monitoring,EnableVirtualMachineIPForwardingMonitoring,resource,MEDIUM,YES,NO,NO,NO,NO,2020-11-30,2017-01-01,https://www.cloudconformity.com/knowledge-base/azure/SecurityCenter/enable-virtual-machine-ip-forwarding-monitoring.html,,,,
azure,SecurityCenter-024,Ensure that the external accounts with write permissions are monitored using Azure Security Center,base,Monitor External Accounts with Write Permissions,ResourceHasValue,resource,MEDIUM,YES,NO,NO,NO,NO,2020-11-30,2017-01-01,https://www.cloudconformity.com/knowledge-base/azure/SecurityCenter/monitor-external-accounts-with-write-permissions.html,,,,
azure,SecurityCenter-025,Ensure that monitoring of DDoS protection at the Azure virtual network level is enabled,base,Enable DDoS Protection Standard Monitoring for Public Virtual Networks,EnableDDoSProtectionStandardMonitoring,resource,HIGH,YES,NO,NO,NO,NO,2020-11-30,2017-01-01,https://www.cloudconformity.com/knowledge-base/azure/SecurityCenter/enable-ddos-protection-standard-monitoring.html,,,,
azure,ActiveDirectory-001,Ensure that multi-factor authentication is enabled for all privileged users (Not Scored),base,Multi-factor Authentication For All Privileged Users,MultiFactorAuthenticationForAllPrivilegedUsers,account,MEDIUM,YES,NO,NO,NO,NO,2019-10-09,2017-01-01,https://www.cloudconformity.com/knowledge-base/azure/ActiveDirectory/multi-factor-authentication-for-all-privileged-users.html,,,True,
azure,ActiveDirectory-002,Ensure that multi-factor authentication is enabled for all non-privileged users (Not Scored),base,Multi-factor Authentication For All Non-privileged Users,MultiFactorAuthenticationForAllNonPrivilegedUsers,account,MEDIUM,YES,NO,NO,NO,NO,2019-10-09,2017-01-01,https://www.cloudconformity.com/knowledge-base/azure/ActiveDirectory/multi-factor-authentication-for-all-non-privileged-users.html,,,True,
azure,ActiveDirectory-003,Ensure there are no Microsoft Azure Active Directory guest users if they are not needed.,base,Check for Active Directory Guest Users,CheckForGuestUsers,service,MEDIUM,YES,NO,NO,NO,NO,2020-05-01,2017-01-01,https://www.cloudconformity.com/knowledge-base/azure/ActiveDirectory/check-for-guest-users.html,,,,
azure,ActiveDirectory-004,Ensure that 'Allow users to remember multi-factor authentication on devices they trust' is 'Disabled' (Not Scored),base,Multi-factor Authentication On Devices,MultiFactorAuthenticationOnDevices,account,HIGH,YES,NO,NO,NO,NO,2019-10-09,2017-01-01,https://www.cloudconformity.com/knowledge-base/azure/ActiveDirectory/multi-factor-authentication-on-devices.html,,,True,
azure,ActiveDirectory-005,Ensure that 'Allow users to remember multi-factor authentication on devices they trust' is 'Disabled' (Not Scored),base,Number Of Methods Required To Reset Password,NumberOfMethodsRequiredToResetPassword,account,MEDIUM,YES,NO,NO,NO,NO,2019-10-09,2017-01-01,https://www.cloudconformity.com/knowledge-base/azure/ActiveDirectory/number-of-methods-required-to-reset-password.html,,,True,
azure,ActiveDirectory-006,Ensure that 'Number of days before users are asked to re-confirm their authentication information' is not set to '0' (Not Scored),base,Number Of Days Before Authentication Information Re-confirmation,NumberOfDaysBeforeAuthenticationInformationReConfirmation,account,MEDIUM,YES,NO,NO,NO,NO,2019-10-09,2017-01-01,https://www.cloudconformity.com/knowledge-base/azure/ActiveDirectory/number-of-days-before-authentication-information-re-confirmation.html,,,True,
azure,ActiveDirectory-007,Ensure that 'Notify users on password resets?' is set to 'Yes' (Not Scored),base,Notify Users On Password Resets,NotifyUsersOnPasswordResets,account,MEDIUM,YES,NO,NO,NO,NO,2019-10-09,2017-01-01,https://www.cloudconformity.com/knowledge-base/azure/ActiveDirectory/notify-users-on-password-resets.html,,,True,
azure,ActiveDirectory-008,Ensure that 'Notify all admins when other admins reset their password?' is set to 'Yes' (Not Scored),base,Notify All Admins When Other Admins Reset Their Password,NotifyAllAdminsWhenOtherAdminsResetTheirPassword,account,HIGH,YES,NO,NO,NO,NO,2019-10-09,2017-01-01,https://www.cloudconformity.com/knowledge-base/azure/ActiveDirectory/notify-all-admins-when-other-admins-reset-their-password.html,,,True,
azure,ActiveDirectory-009,Ensure that 'Users can consent to apps accessing company data on their behalf' is set to 'No' (Not Scored),base,Users Can Consent To Apps Accessing Company Data On Their Behalf,UsersCanConsentToAppsAccessingCompanyDataOnTheirBehalf,account,HIGH,YES,NO,NO,NO,NO,2019-10-09,2017-01-01,https://www.cloudconformity.com/knowledge-base/azure/ActiveDirectory/users-can-consent-to-apps-accessing-company-data-on-their-behalf.html,,,True,
azure,ActiveDirectory-010,Ensure that 'Users can add gallery apps to their Access Panel' is set to 'No' (Not Scored),base,Users Can Add Gallery Apps To Their Access Panel,UsersCanAddGalleryAppsToTheirAccessPanel,account,HIGH,YES,NO,NO,NO,NO,2019-10-09,2017-01-01,https://www.cloudconformity.com/knowledge-base/azure/ActiveDirectory/users-can-add-gallery-apps-to-their-access-panel.html,,,True,
azure,ActiveDirectory-011,Ensure that 'Users can register applications' is set to 'No' (Not Scored),base,Users Can Register Applications,UsersCanRegisterApplications,account,HIGH,YES,NO,NO,NO,NO,2019-10-09,2017-01-01,https://www.cloudconformity.com/knowledge-base/azure/ActiveDirectory/users-can-register-applications.html,,,True,
azure,ActiveDirectory-012,Ensure that 'Guest user permissions are limited' is set to 'Yes' (Not Scored),base,Guest User Permissions Are Limited,GuestUserPermissionsAreLimited,account,HIGH,YES,NO,NO,NO,NO,2019-10-09,2017-01-01,https://www.cloudconformity.com/knowledge-base/azure/ActiveDirectory/guest-user-permissions-are-limited.html,,,True,
azure,ActiveDirectory-013,Ensure that 'Members can invite' is set to 'No' (Not Scored),base,Members Can Invite,MembersCanInvite,account,HIGH,YES,NO,NO,NO,NO,2019-10-09,2017-01-01,https://www.cloudconformity.com/knowledge-base/azure/ActiveDirectory/members-can-invite.html,,,True,
azure,ActiveDirectory-014,Ensure that 'Guests can invite' is set to 'No' (Not Scored),base,Guests Can Invite,GuestsCanInvite,account,HIGH,YES,NO,NO,NO,NO,2019-10-09,2017-01-01,https://www.cloudconformity.com/knowledge-base/azure/ActiveDirectory/guests-can-invite.html,,,True,
azure,ActiveDirectory-015,Ensure that 'Restrict access to Azure AD administration portal' is set to 'Yes' (Not Scored),base,Restrict Access To Azure AD Administration Portal,RestrictAccessToAzureADAdministrationPortal,account,MEDIUM,YES,NO,NO,NO,NO,2019-10-09,2017-01-01,https://www.cloudconformity.com/knowledge-base/azure/ActiveDirectory/restrict-access-to-azure-ad-administration-portal.html,,,True,
azure,ActiveDirectory-016,Ensure that 'Self-service group management enabled' is set to 'No' (Not Scored),base,Self-service Group Management Enabled,SelfServiceGroupManagementEnabled,account,HIGH,YES,NO,NO,NO,NO,2019-10-09,2017-01-01,https://www.cloudconformity.com/knowledge-base/azure/ActiveDirectory/self-service-group-management-enabled.html,,,True,
azure,ActiveDirectory-017,Ensure that 'Users can create security groups' is set to 'No' (Not Scored),base,Users Can Create Security Groups,UsersCanCreateSecurityGroups,account,HIGH,YES,NO,NO,NO,NO,2019-10-09,2017-01-01,https://www.cloudconformity.com/knowledge-base/azure/ActiveDirectory/users-can-create-security-groups.html,,,True,
azure,ActiveDirectory-018,Ensure that 'Users who can manage security groups' is set to 'None' (Not Scored),base,Users Who Can Manage Security Groups,UsersWhoCanManageSecurityGroups,account,HIGH,YES,NO,NO,NO,NO,2019-10-09,2017-01-01,https://www.cloudconformity.com/knowledge-base/azure/ActiveDirectory/users-who-can-manage-security-groups.html,,,True,
azure,ActiveDirectory-019,Ensure that 'Users can create Office 365 groups' is set to 'No' (Not Scored),base,Users Can Create Office 365 Groups,UsersCanCreateOffice365Groups,account,HIGH,YES,NO,NO,NO,NO,2019-10-09,2017-01-01,https://www.cloudconformity.com/knowledge-base/azure/ActiveDirectory/users-can-create-office-365-groups.html,,,True,
azure,ActiveDirectory-020,Ensure that 'Users who can manage Office 365 groups' is set to 'None' (Not Scored),base,Users Who Can Manage Office 365 Groups,UsersWhoCanManageOffice365Groups,account,HIGH,YES,NO,NO,NO,NO,2019-10-09,2017-01-01,https://www.cloudconformity.com/knowledge-base/azure/ActiveDirectory/users-can-manage-office-365-groups.html,,,True,
azure,ActiveDirectory-022,Ensure that 'Require Multi-Factor Auth to join devices' is set to 'Yes' (Not Scored),base,Require Multi-Factor Auth To Join Devices,RequireMultiFactorAuthToJoinDevices,account,MEDIUM,YES,NO,NO,NO,NO,2019-10-09,2017-01-01,https://www.cloudconformity.com/knowledge-base/azure/ActiveDirectory/require-multi-factor-auth-to-join-devices.html,,,True,
azure,MySQL-001,Ensure 'Enforce SSL connection' is set to 'ENABLED' for MySQL Database Server,base,SSL Connection,SSLConnection,resource,MEDIUM,YES,NO,NO,NO,NO,2020-04-02,2017-01-01,https://www.cloudconformity.com/knowledge-base/azure/MySQL/in-transit-encryption.html,,,,
azure,PostgreSQL-001,Ensure server parameter 'log_checkpoints' is set to 'ON' for PostgreSQL Database Server,base,Log Checkpoints,LogCheckpoints,resource,MEDIUM,YES,NO,NO,NO,NO,2020-05-01,2017-01-01,https://www.cloudconformity.com/knowledge-base/azure/PostgreSQL/log-checkpoints.html,,,,
azure,PostgreSQL-002,Ensure 'Enforce SSL connection' is set to 'ENABLED' for PostgreSQL Database Server,base,SSL Connection,SSLConnection,resource,MEDIUM,YES,NO,NO,NO,NO,2020-04-02,2017-01-01,https://www.cloudconformity.com/knowledge-base/azure/PostgreSQL/in-transit-encryption.html,,,,
azure,PostgreSQL-003,Ensure server parameter 'log_connections' is set to 'ON' for PostgreSQL Database Server,base,Log Connections,LogConnections,resource,MEDIUM,YES,NO,NO,NO,NO,2020-05-01,2017-01-01,https://www.cloudconformity.com/knowledge-base/azure/PostgreSQL/log-connections.html,,,,
azure,PostgreSQL-004,Ensure server parameter 'log_disconnections' is set to 'ON' for PostgreSQL Database Server,base,Log Disconnections,LogDisconnections,resource,MEDIUM,YES,NO,NO,NO,NO,2020-05-01,2017-01-01,https://www.cloudconformity.com/knowledge-base/azure/PostgreSQL/log-disconnections.html,,,,
azure,PostgreSQL-005,Ensure server parameter 'log_duration' is set to 'ON' for PostgreSQL Database Server,base,Log Duration,LogDuration,resource,MEDIUM,YES,NO,NO,NO,NO,2020-05-01,2017-01-01,https://www.cloudconformity.com/knowledge-base/azure/PostgreSQL/log-duration.html,,,,
azure,PostgreSQL-006,Ensure server parameter 'connection_throttling' is set to 'ON' for PostgreSQL Database Server,base,Connection Throttling,ConnectionThrottling,resource,MEDIUM,YES,NO,NO,NO,NO,2020-05-01,2017-01-01,https://www.cloudconformity.com/knowledge-base/azure/PostgreSQL/connection-throttling.html,,,,
azure,PostgreSQL-007,Ensure server parameter 'log_retention_days' is greater than 3 days for PostgreSQL Database Server,base,Log Retention Days,LogRetentionDays,resource,MEDIUM,YES,YES,NO,NO,NO,2020-05-01,2017-01-01,https://www.cloudconformity.com/knowledge-base/azure/PostgreSQL/log-retention-days.html,,,,
azure,PostgreSQL-008,Ensure that Azure Active Directory Admin is configured (Not Scored),base,Active Directory Admin,ActiveDirectoryAdmin,account,MEDIUM,YES,NO,NO,NO,NO,2020-06-01,2017-01-01,https://www.cloudconformity.com/knowledge-base/azure/PostgreSQL/active-directory-admin.html,,,True,
azure,PostgreSQL-009,Ensure that PostgreSQL database servers are using the latest major version of PostgreSQL database,base,Check for PostgreSQL Major Version,ResourceHasValue,resource,LOW,YES,YES,YES,NO,NO,2020-11-30,2017-01-01,https://www.cloudconformity.com/knowledge-base/azure/PostgreSQL/latest-major-version-check.html,,,,
azure,PostgreSQL-010,Ensure that geo-redundant backups are enabled for your Azure PostgreSQL database servers,base,Enable Geo-Redundant Backups,ResourceHasValue,resource,HIGH,NO,YES,NO,NO,NO,2020-11-30,2017-01-01,https://www.cloudconformity.com/knowledge-base/azure/PostgreSQL/enable-geo-redundant-backups.html,,,,
azure,PostgreSQL-011,Ensure that storage auto-growth is enabled for your Microsoft Azure PostgreSQL database servers,base,Enable Storage Auto-Growth,ResourceHasValue,resource,HIGH,NO,YES,NO,NO,NO,2020-11-30,2017-01-01,https://www.cloudconformity.com/knowledge-base/azure/PostgreSQL/enable-storage-auto-growth.html,,,,
azure,Sql-001,Ensure that 'Auditing' is set to 'On',base,Auditing,Auditing,resource,MEDIUM,YES,NO,NO,NO,NO,2020-04-02,2017-01-01,https://www.cloudconformity.com/knowledge-base/azure/Sql/auditing.html,,,,
azure,Sql-002,Ensure that 'AuditActionGroups' in 'auditing' policy for a SQL server is set properly,base,Audit Action Groups,AuditActionGroups,resource,MEDIUM,YES,NO,NO,NO,NO,2020-04-02,2017-01-01,https://www.cloudconformity.com/knowledge-base/azure/Sql/audit-action-groups.html,,,,
azure,Sql-003,Ensure that 'Auditing' Retention is 'greater than 90 days',base,Auditing Retention,AuditingRetention,resource,MEDIUM,YES,NO,NO,NO,NO,2020-05-01,2017-01-01,https://www.cloudconformity.com/knowledge-base/azure/Sql/auditing-retention.html,,,,
azure,Sql-004,Ensure that Azure Active Directory Admin is configured,base,Active Directory Admin,ActiveDirectoryAdmin,resource,MEDIUM,YES,NO,NO,NO,NO,2020-05-01,2017-01-01,https://www.cloudconformity.com/knowledge-base/azure/Sql/active-directory-admin.html,,,,
azure,Sql-005,Ensure that 'Data encryption' is set to 'On' on a SQL Database,base,Data Encryption,DataEncryption,resource,MEDIUM,YES,NO,NO,NO,NO,2020-05-01,2017-01-01,https://www.cloudconformity.com/knowledge-base/azure/Sql/data-encryption.html,,,,
azure,Sql-006,Ensure that Advanced Data Security (ADS) is enabled at the Azure SQL Database Server level,base,Enable Advanced Data Security for SQL Servers,AdvancedDataSecurityEnabled,resource,MEDIUM,YES,NO,NO,NO,NO,2020-05-01,2017-01-01,https://www.cloudconformity.com/knowledge-base/azure/Sql/advanced-data-security-policy.html,,,,
azure,Sql-007,Enable all types of threat detection for your Microsoft Azure SQL Database Servers,base,Enable All Threat Detection Types,EnableAllThreatDetectionTypes,resource,HIGH,YES,NO,NO,NO,NO,2020-05-01,2017-01-01,https://www.cloudconformity.com/knowledge-base/azure/Sql/enable-all-threat-detection-types.html,,,,
azure,Sql-008,Enable threat detection email notification alerts for your Microsoft Azure SQL servers,base,Enable Email Alerts for SQL Threat Detection Service,EnableThreatDetectionEmailAlerts,resource,HIGH,YES,NO,NO,NO,NO,2020-05-01,2017-01-01,https://www.cloudconformity.com/knowledge-base/azure/Sql/enable-email-alerts-for-sql-threat-detection.html,,,,
azure,Sql-009,Enable administrators and subscription owners to receive threat detection email notification alerts for SQL serversx.,base,Enable Email Alerts for Administrators and Subscription Owners,EnableThreatDetectionEmailAlertsForAdmins,resource,MEDIUM,YES,NO,NO,NO,NO,2020-05-01,2017-01-01,https://www.cloudconformity.com/knowledge-base/azure/Sql/enable-email-alerts-for-administrators-and-subscription-owners.html,,,,
azure,Sql-010,Ensure that no SQL databases allow unrestricted inbound access from 0.0.0.0/0 (any IP address),base,Check for Unrestricted SQL Database Access,DatabaseServerUnrestrictedAccess,resource,VERY_HIGH,YES,NO,NO,NO,NO,2020-05-01,2017-01-01,https://www.cloudconformity.com/knowledge-base/azure/Sql/unrestricted-sql-database-access.html,,,,
azure,Sql-011,Ensure SQL server's TDE protector is encrypted with BYOK (Use your own key).,base,Use BYOK for Transparent Data Encryption,UseBYOKForTransparentDataEncryption,resource,MEDIUM,YES,NO,NO,NO,NO,2020-05-01,2017-01-01,https://www.cloudconformity.com/knowledge-base/azure/Sql/use-byok-for-transparent-data-encryption.html,,,,
azure,Sql-012,Ensure that Automatic Tuning feature is enabled for Microsoft Azure SQL database servers.,base,Enable Automatic Tuning for SQL Database Servers,AutomaticTuning,resource,MEDIUM,NO,NO,YES,NO,NO,2020-06-30,2017-01-01,https://www.cloudconformity.com/knowledge-base/azure/Sql/enable-automatic-tuning.html,,,,
azure,Sql-013,Ensure that Azure SQL database servers are accessible via private endpoints only.,base,Check for Publicly Accessible SQL Servers,PubliclyAccessibleSQLServers,resource,HIGH,YES,NO,NO,NO,NO,2020-06-30,2017-01-01,https://www.cloudconformity.com/knowledge-base/azure/Sql/publicly-accessible-sql-servers.html,,,,
azure,Sql-014,Ensure that your Azure SQL database servers are configured to use auto-failover groups.,base,Enable Auto-Failover Groups,EnableAutoFailoverGroups,resource,MEDIUM,NO,YES,NO,NO,NO,2020-06-30,2017-01-01,https://www.cloudconformity.com/knowledge-base/azure/Sql/enable-auto-failover-groups.html,,,,
azure,Sql-015,Ensure there is a sufficient PITR backup retention period configured for Azure SQL databases,base,Check for Sufficient Point in Time Restore (PITR) Backup Retention Period,SufficientPITRBackupRetentionPeriod,resource,MEDIUM,NO,YES,NO,NO,NO,2020-12-18,2017-01-01,https://www.cloudconformity.com/knowledge-base/azure/Sql/sufficient-pitr-backup.html,,True,,
