provider,id,description,package,title,name,level,risk-level,security,reliability,performance-efficiency,cost-optimisation,operational-excellence,release-date,update-date,knowledge-base-html,multi-risk-level,must-be-configured,not-scored,categories
aws,ASG-012,Ensure that each Auto Scaling Group (ASG) has an associated Elastic Load Balancer (ELB) in order to maintain the availability of the EC2 compute resources in the event of a failure and provide an evenly distributed application load,base,Auto Scaling Group associated ELB,ASGAssociatedELB,resource,MEDIUM,NO,YES,NO,NO,NO,2019-08-23,2017-01-01,https://www.cloudconformity.com/knowledge-base/aws/ASG/autoscaling-group-associated-load-balancer.html,,,,
aws,ASG-013,Ensure that each web-tier Auto Scaling Group (ASG) has an associated Elastic Load Balancer (ELB) in order to maintain the availability of the EC2 compute resources in the event of a failure and provide an evenly distributed application load,base,Web-Tier Auto Scaling Group associated ELB,ASGAssociatedELB,resource,MEDIUM,NO,YES,NO,NO,NO,2019-08-23,2017-01-01,https://www.cloudconformity.com/knowledge-base/aws/ASG/web-tier-autoscaling-group-associated-load-balancer.html,,True,,
aws,ASG-014,Ensure that each app-tier Auto Scaling Group (ASG) has an associated Elastic Load Balancer (ELB) in order to maintain the availability of the EC2 compute resources in the event of a failure and provide an evenly distributed application load,base,App-Tier Auto Scaling Group associated ELB,ASGAssociatedELB,resource,MEDIUM,NO,YES,NO,NO,NO,2019-08-23,2017-01-01,https://www.cloudconformity.com/knowledge-base/aws/ASG/app-tier-autoscaling-group-associated-load-balancer.html,,True,,
aws,RS-001,Ensure Redshift clusters are not publicly accessible to minimise security risks,base,Redshift Cluster Publicly Accessible,ClusterPubliclyAccessible,resource,HIGH,YES,NO,NO,NO,NO,2017-01-01,2018-05-23,https://www.cloudconformity.com/knowledge-base/aws/RS/redshift-cluster-publicly-accessible.html,,,,
aws,RS-002,Ensure encryption is setup for Redshift clusters to fulfill compliance requirements for data-at-rest encryption,base,Redshift Cluster Encrypted,ClusterEncrypted,resource,HIGH,YES,NO,NO,NO,NO,2017-01-01,2017-01-01,https://www.cloudconformity.com/knowledge-base/aws/RS/redshift-cluster-encrypted.html,,,,
aws,RS-003,Ensure Redshift clusters are encrypted with CMKs to have full control over encrypting and decrypting data,base,Redshift Cluster Encrypted With KMS Customer Master Keys,ClusterEncryptedWithCMK,resource,HIGH,YES,NO,NO,NO,NO,2017-01-01,2018-05-23,https://www.cloudconformity.com/knowledge-base/aws/RS/redshift-cluster-encrypted-with-kms-customer-master-keys.html,,,,
aws,RS-004,Ensure Redshift clusters are launched in VPC,base,Redshift Cluster In VPC,ClusterInVPC,resource,MEDIUM,YES,NO,NO,NO,NO,2017-01-01,2017-01-01,https://www.cloudconformity.com/knowledge-base/aws/RS/redshift-cluster-in-vpc.html,,,,
aws,RS-005,Ensure Version Upgrade is enabled for Redshift clusters to automatically receive upgrades during the maintenance window,base,Redshift Cluster Allow Version Upgrade,ClusterAllowVersionUpgrade,resource,MEDIUM,YES,NO,NO,NO,NO,2017-01-01,2017-01-01,https://www.cloudconformity.com/knowledge-base/aws/RS/redshift-cluster-allow-version-upgrade.html,,,,
aws,RS-006,Ensure audit logging is enabled for Redshift clusters for security and troubleshooting purposes,base,Redshift Cluster Audit Logging Enabled,ClusterAuditLoggingEnabled,resource,MEDIUM,YES,NO,NO,NO,NO,2017-01-01,2018-05-23,https://www.cloudconformity.com/knowledge-base/aws/RS/redshift-cluster-audit-logging-enabled.html,,,,
aws,RS-007,Ensure that all the parameter groups associated with your Amazon Redshift clusters have the require_ssl parameter enabled,base,Redshift Parameter Group Require SSL,RequireSSL,resource,MEDIUM,YES,NO,NO,NO,NO,2017-01-01,2018-04-09,https://www.cloudconformity.com/knowledge-base/aws/RS/redshift-parameter-groups-require-ssl.html,,,,
aws,RS-008,Ensure Redshift clusters are using the latest generation of nodes for cost and performance improvements,base,Redshift Instance Generation,RedshiftInstanceGeneration,resource,MEDIUM,NO,NO,YES,YES,NO,2017-01-01,2017-01-01,https://www.cloudconformity.com/knowledge-base/aws/RS/redshift-instance-generation.html,,,,
aws,RS-009,Identify any Amazon Redshift clusters that appear to be idle and delete them to help lower the cost of your monthly AWS bill,base,Idle Redshift Cluster,ClusterIdle,resource,HIGH,NO,NO,NO,YES,NO,2017-01-01,2020-06-01,https://www.cloudconformity.com/knowledge-base/aws/RS/idle-cluster.html,,,,
aws,RS-010,Ensure Redshift Reserved Nodes are renewed 7 days before expiration,base,Redshift Reserved Node Lease Expiration In The Next 7 Days,ReservedNodeLeaseExpirationIn7Days,resource,HIGH,NO,NO,NO,YES,NO,2017-01-01,2020-06-01,https://www.cloudconformity.com/knowledge-base/aws/RS/reserved-node-lease-expiration-in-7-days.html,,,,
aws,RS-011,Ensure Redshift Reserved Nodes are renewed 30 days before expiration,base,Redshift Reserved Node Lease Expiration In The Next 30 Days,ReservedNodeLeaseExpirationIn30Days,resource,MEDIUM,NO,NO,NO,YES,NO,2017-01-01,2020-06-01,https://www.cloudconformity.com/knowledge-base/aws/RS/reserved-node-lease-expiration-in-30-days.html,,,,
aws,RS-012,Ensure Redshift Reserved Nodes purchases have not failed,base,Redshift Reserved Node Payment Failed,ReservedNodePaymentFailed,resource,HIGH,NO,NO,NO,YES,NO,2017-01-01,2020-06-01,https://www.cloudconformity.com/knowledge-base/aws/RS/reserved-node-payment-failed.html,,,,
aws,RS-013,Ensure Redshift Reserved Nodes purchases are not pending,base,Redshift Reserved Node Payment Pending,ReservedNodePaymentPending,resource,HIGH,NO,NO,NO,YES,NO,2017-01-01,2020-06-01,https://www.cloudconformity.com/knowledge-base/aws/RS/reserved-node-payment-pending.html,,,,
aws,RS-014,Ensure Redshift Reserved Nodes purchases are regularly reviewed,base,Redshift Reserved Node Recent Purchases,ReservedNodeRecentPurchases,resource,LOW,NO,NO,NO,YES,NO,2017-01-01,2020-06-01,https://www.cloudconformity.com/knowledge-base/aws/RS/reserved-node-recent-purchases.html,,,True,
aws,RS-015,Identify underutilized Redshift clusters and downsize them in order to optimize AWS costs,base,Underutilized Redshift Cluster,UnderutilizedRedshiftCluster,resource,HIGH,NO,NO,NO,YES,NO,2017-01-01,2020-06-01,https://www.cloudconformity.com/knowledge-base/aws/RS/underutilized-cluster.html,,,,
aws,RS-016,Ensure that your Amazon Redshift Reserved Nodes are being utilized,base,Unused Redshift Reserved Nodes,ReservedNodeUnused,cross-account,HIGH,NO,NO,NO,YES,NO,2017-01-01,2020-06-01,https://www.cloudconformity.com/knowledge-base/aws/RS/unused-reserved-nodes.html,,,,
aws,RS-017,Ensure Amazon Redshift clusters are not using port 5439 (default port) for database access,base,Redshift Cluster Default Port,DefaultPort,resource,LOW,YES,NO,NO,NO,NO,2017-01-01,2017-01-01,https://www.cloudconformity.com/knowledge-base/aws/RS/default-port.html,,,,
aws,RS-018,Ensure AWS Redshift database clusters are not using 'awsuser' (default master username) for database access,base,Redshift Cluster Default Master Username,MasterUsername,resource,LOW,YES,NO,NO,NO,NO,2017-01-01,2017-01-01,https://www.cloudconformity.com/knowledge-base/aws/RS/master-username.html,,,,
aws,RS-019,Ensure that retention period is enabled for Amazon Redshift automated snapshots,base,Redshift Automated Snapshot Retention Period,AutomatedSnapshotRetentionPeriod,resource,LOW,YES,NO,NO,NO,NO,2017-01-01,2017-01-01,https://www.cloudconformity.com/knowledge-base/aws/RS/automated-snapshot-retention-period.html,,,,
aws,RS-020,Identify AWS Redshift clusters with high disk usage and scale them to increase their storage capacity,base,Redshift Disk Space Usage,DiskSpaceUsed,resource,HIGH,NO,NO,YES,NO,NO,2017-01-01,2018-09-27,https://www.cloudconformity.com/knowledge-base/aws/RS/disk-space-used.html,,,,
aws,RS-021,Ensure that your AWS account has not reached the limit set for the number of Redshift cluster nodes,base,Redshift Nodes Counts,NodeCounts,service,MEDIUM,YES,NO,NO,NO,NO,2017-01-01,2018-09-27,https://www.cloudconformity.com/knowledge-base/aws/RS/node-counts.html,,,,
aws,RS-022,Ensure that your AWS Redshift cluster nodes are of given types,base,Redshift Desired Node Type,DesiredNodeType,resource,MEDIUM,YES,NO,NO,NO,NO,2017-01-01,2017-01-01,https://www.cloudconformity.com/knowledge-base/aws/RS/desired-node-type.html,,True,,
aws,RS-023,Ensure that user activity logging is enabled for Redshift clusters,base,Enable Redshift User Activity Logging,UserActivityLogging,resource,LOW,YES,NO,NO,NO,NO,2018-04-09,2018-05-23,https://www.cloudconformity.com/knowledge-base/aws/RS/user-activity-log.html,,,,
aws,RS-024,Enable Deferred Maintenance for Redshift Clusters,base,Deferred Maintenance,DeferredMaintenance,resource,MEDIUM,NO,YES,NO,NO,NO,2019-04-04,2017-01-01,https://www.cloudconformity.com/knowledge-base/aws/RS/deferred-maintenance-enabled.html,,,,
aws,CW-001,Create a CloudWatch billing alarm to receive alerts when your AWS charges exceed a threshold you choose,base,Billing Alarm,BillingAlarm,service,HIGH,YES,NO,NO,NO,NO,2017-01-01,2017-01-01,https://www.cloudconformity.com/knowledge-base/aws/CW/billing-alarm.html,,True,,
aws,CWE-001,Ensure CloudWatch Events is in use to help you respond to operational changes within your AWS resources,base,AWS CloudWatch Events In Use,CloudWatchEventsInUse,service,MEDIUM,YES,YES,YES,YES,YES,2017-01-01,2017-01-01,https://www.cloudconformity.com/knowledge-base/aws/CWE/events-in-use.html,,,,
aws,CWE-002,Ensure that your Amazon CloudWatch event buses are configured to allow access only to friendly AWS accounts,base,EventBus Cross Account Access,EventBusCrossAccountAccess,resource,HIGH,YES,NO,NO,NO,NO,2018-04-09,2017-01-01,https://www.cloudconformity.com/knowledge-base/aws/CWE/event-bus-cross-account-access.html,,,,
aws,CWE-003,Ensure CloudWatch event buses are not exposed to everyone,base,Event Bus Exposed,EventBusExposed,resource,HIGH,YES,NO,NO,NO,NO,2018-08-20,2017-01-01,https://www.cloudconformity.com/knowledge-base/aws/CWE/event-bus-exposed.html,,,,
aws,CWL-001,Ensure a log metric filter and alarm exist for AWS Management Console authentication failures,base,Console Sign-in Failures Alarm,ConsoleSignInFailuresAlarm,service,MEDIUM,YES,NO,NO,NO,NO,2017-01-01,2019-02-07,https://www.cloudconformity.com/knowledge-base/aws/CWL/console-sign-in-failures-alarm.html,,,,
aws,CWL-002,Ensure a log metric filter and alarm exist for unauthorized API calls,base,Authorization Failures Alarm,AuthorizationFailuresAlarm,service,MEDIUM,YES,NO,NO,NO,NO,2017-01-01,2019-02-07,https://www.cloudconformity.com/knowledge-base/aws/CWL/authorization-failures-alarm.html,,,,
aws,CWL-003,Ensure a log metric filter and alarm exist for CloudTrail configuration changes,base,CloudTrail Changes Alarm,CloudTrailChangesAlarm,service,MEDIUM,YES,NO,NO,NO,NO,2017-01-01,2019-02-07,https://www.cloudconformity.com/knowledge-base/aws/CWL/cloudtrail-changes-alarm.html,,,,
aws,CWL-004,Ensure a log metric filter and alarm exist for security group changes,base,Security Group Changes Alarm,SecurityGroupChangesAlarm,service,MEDIUM,YES,NO,NO,NO,NO,2017-01-01,2019-02-07,https://www.cloudconformity.com/knowledge-base/aws/CWL/securitygroup-changes-alarm.html,,,,
aws,CWL-005,Ensure a log metric filter and alarm exist for changes to Network Access Control Lists (NACL),base,Network ACL Changes Alarm,NetworkACLChangesAlarm,service,MEDIUM,YES,NO,NO,NO,NO,2017-01-01,2019-02-07,https://www.cloudconformity.com/knowledge-base/aws/CWL/network-acl-changes-alarm.html,,,,
aws,CWL-006,Ensure a log metric filter and alarm exist for changes to network gateways,base,Internet Gateway Changes Alarm,InternetGatewayChangesAlarm,service,MEDIUM,YES,NO,NO,NO,NO,2017-01-01,2019-02-07,https://www.cloudconformity.com/knowledge-base/aws/CWL/internet-gateway-changes-alarm.html,,,,
aws,CWL-007,Ensure a log metric filter and alarm exist for VPC changes,base,VPC Changes Alarm,VPCChangesAlarm,service,MEDIUM,YES,NO,NO,NO,NO,2017-01-01,2019-02-07,https://www.cloudconformity.com/knowledge-base/aws/CWL/vpc-changes-alarm.html,,,,
aws,CWL-008,Create a CloudWatch alarm that is triggered when EC2 Instance configuration changes,base,EC2 Instance Changes Alarm,EC2InstanceChangesAlarm,service,MEDIUM,YES,NO,NO,NO,NO,2017-01-01,2019-02-07,https://www.cloudconformity.com/knowledge-base/aws/CWL/ec2-instance-changes-alarm.html,,,,
aws,CWL-009,Create a CloudWatch alarm that is triggered when EC2 Large Instance configuration changes,base,EC2 Large Instance Changes Alarm,EC2LargeInstanceChangesAlarm,service,MEDIUM,YES,NO,NO,NO,NO,2017-01-01,2019-02-07,https://www.cloudconformity.com/knowledge-base/aws/CWL/ec2-large-instance-changes-alarm.html,,,,
aws,CWL-010,Ensure a log metric filter and alarm exist for IAM policy changes,base,IAM Policy Changes Alarm,IAMPolicyChangesAlarm,service,HIGH,YES,NO,NO,NO,NO,2017-01-01,2019-02-07,https://www.cloudconformity.com/knowledge-base/aws/CWL/iam-policy-changes-alarm.html,,,,
aws,CWL-011,Ensure a log metric filter and alarm exist for AWS Config configuration changes,base,AWS Config Changes Alarm,AWSConfigChangesAlarm,service,MEDIUM,YES,NO,NO,NO,NO,2017-01-01,2019-02-07,https://www.cloudconformity.com/knowledge-base/aws/CWL/aws-config-changes-alarm.html,,,,
aws,CWL-012,Ensure a log metric filter and alarm exist for S3 bucket policy changes,base,S3 Bucket Changes Alarm,S3BucketChangesAlarm,service,MEDIUM,YES,NO,NO,NO,NO,2017-01-01,2019-02-07,https://www.cloudconformity.com/knowledge-base/aws/CWL/s3-bucket-changes-alarm.html,,,,
aws,CWL-013,Ensure a log metric filter and alarm exist for route table changes,base,Route Table Changes Alarm,RouteTableChangesAlarm,service,MEDIUM,YES,NO,NO,NO,NO,2017-01-01,2019-02-07,https://www.cloudconformity.com/knowledge-base/aws/CWL/route-table-changes-alarm.html,,,,
aws,CWL-014,Ensure a log metric filter and alarm exist for usage of 'root' account,base,Root Account Usage Alarm,RootAccountUsageAlarm,service,HIGH,YES,NO,NO,NO,NO,2017-01-01,2018-12-06,https://www.cloudconformity.com/knowledge-base/aws/CWL/root-account-usage-alarm.html,,,,
aws,CWL-015,Ensure a log metric filter and alarm exist for disabling or scheduled deletion of customer created CMKs,base,CMK Disabled or Scheduled for Deletion Alarm,CMKDisabledOrScheduledForDeletionAlarm,service,MEDIUM,YES,NO,NO,NO,NO,2017-01-01,2019-02-07,https://www.cloudconformity.com/knowledge-base/aws/CWL/cmk-disabled-or-scheduled-for-deletion-alarm.html,,,,
aws,CWL-016,Ensure Amazon Organizations changes are being monitored using AWS CloudWatch alarms,base,AWS Organizations Changes Alarm,AWSOrganizationsChangesAlarm,service,MEDIUM,YES,NO,NO,NO,NO,2017-01-01,2019-02-07,https://www.cloudconformity.com/knowledge-base/aws/CWL/organizations-changes-alarm.html,,,,
aws,CWL-017,Ensure a log metric filter and alarm exist for Management Console sign-in without MFA,base,AWS Console Sign In Without MFA,ConsoleSignInWithoutMFA,service,MEDIUM,YES,NO,NO,NO,NO,2017-01-01,2019-02-07,https://www.cloudconformity.com/knowledge-base/aws/CWL/console-sign-in-without-mfa.html,,,,
aws,CWL-018,Ensure that a metric filter that matches the pattern of the rejected traffic is created for the AWS CloudWatch log group assigned to VPC Flow Logs.,base,Metric Filter for VPC Flow Logs CloudWatch Log Group,MetricFilterForVPCFlowLogsCloudWatchLogGroup,resource,HIGH,YES,NO,NO,NO,NO,2020-07-30,2017-01-01,https://www.cloudconformity.com/knowledge-base/aws/CWL/vpc-flow-logs-cloudwatch-log-metric-filter.html,,True,,
aws,CWL-019,Ensure that a CloudWatch alarm is created for the VPC Flow Logs metric filter and an alarm action is configured.,base,Create CloudWatch Alarm for VPC Flow Logs Metric Filter,CreateCloudWatchAlarmForVPCFlowLogsMetricFilter,resource,HIGH,YES,NO,NO,NO,NO,2020-07-30,2017-01-01,https://www.cloudconformity.com/knowledge-base/aws/CWL/vpc-flow-logs-alarm.html,,True,,
aws,RG-001,"Use tags metadata for identifying and organizing your AWS resources by purpose, owner, environment, or other criteria",base,Tags,Tag,service,LOW,YES,YES,YES,YES,YES,2017-01-01,2020-10-14,https://www.cloudconformity.com/knowledge-base/aws/RG/tags.html,,True,,
aws,SES-001,Ensure DKIM signing is enabled to help with email delivery,base,DKIM Enabled,DKIMEnabled,resource,LOW,YES,NO,NO,NO,NO,2017-01-01,2017-01-01,https://www.cloudconformity.com/knowledge-base/aws/SES/dkim-enabled.html,,,,
aws,SES-002,Ensure AWS SES identities (email addresses and/or domains) are verified,base,Identity Verification Status,IdentityVerificationStatus,resource,LOW,YES,NO,NO,NO,NO,2017-01-01,2017-01-01,https://www.cloudconformity.com/knowledge-base/aws/SES/identity-verification-status.html,,,,
aws,SES-003,Identify any exposed SES identities and update their policy,base,Exposed SES Identities,IdentityExposed,resource,HIGH,YES,NO,NO,NO,NO,2018-04-09,2018-05-23,https://www.cloudconformity.com/knowledge-base/aws/SES/identity-exposed.html,,,,
aws,SES-004,Ensure SES identities are configured to allow access only to trusted AWS accounts,base,Identify Cross-Account Access,IdentifyCrossAccountAccess,resource,HIGH,YES,NO,NO,NO,NO,2018-04-09,2017-01-01,https://www.cloudconformity.com/knowledge-base/aws/SES/identity-cross-account-access.html,,,,
aws,DynamoDB-001,Identify and remove any unused AWS DynamoDB tables to optimize AWS costs,base,Unused Table,TableUnused,resource,MEDIUM,NO,NO,NO,YES,NO,2017-01-01,2020-06-01,https://www.cloudconformity.com/knowledge-base/aws/DynamoDB/unused-dynamodb-tables.html,,,,
aws,DynamoDB-003,Enable DynamoDB Continuous Backups,base,DynamoDB Continuous Backups,ContinuousBackups,resource,HIGH,NO,YES,NO,NO,NO,2019-01-17,2019-06-03,https://www.cloudconformity.com/knowledge-base/aws/DynamoDB/continuous-backups.html,,,,
aws,DynamoDB-004,Use Managed Customer Master Keys for DynamoDB Server-Side Encryption,base,AWS KMS Customer Master Keys for Table Encryption,TableEncryptedWithCMK,resource,HIGH,YES,NO,NO,NO,NO,2019-06-03,2017-01-01,https://www.cloudconformity.com/knowledge-base/aws/DynamoDB/encrypted-with-cmk.html,,,,
aws,DynamoDB-005,Ensure on-demand backup and restore functionality is in use for AWS DynamoDB tables,base,DynamoDB Backup and Restore,BackupAndRestore,resource,HIGH,NO,YES,NO,NO,NO,2020-06-30,2017-01-01,https://www.cloudconformity.com/knowledge-base/aws/DynamoDB/backup-and-restore.html,,,,
aws,EC-001,Ensure ElastiCache clusters are using the latest generation of nodes for cost and performance improvements,base,ElastiCache Instance Generation,ElastiCacheInstanceGeneration,resource,MEDIUM,NO,NO,YES,YES,NO,2017-01-01,2020-06-01,https://www.cloudconformity.com/knowledge-base/aws/EC/elasticache-instance-generation.html,,,,
aws,EC-002,Ensure Amazon ElastiCache Redis clusters have the Multi-AZ feature enabled,base,ElastiCache Redis Multi-AZ,ElastiCacheMultiAZ,resource,MEDIUM,NO,YES,NO,NO,NO,2017-01-01,2019-08-23,https://www.cloudconformity.com/knowledge-base/aws/EC/elasticache-multi-az.html,,,,
aws,EC-003,Ensure Amazon ElastiCache clusters are deployed into a Virtual Private Cloud,base,ElastiCache Cluster In VPC,ClusterInVPC,resource,MEDIUM,YES,NO,NO,NO,NO,2017-01-01,2019-08-23,https://www.cloudconformity.com/knowledge-base/aws/EC/cluster-in-vpc.html,,,,
aws,EC-004,Ensure ElastiCache Reserved Cache Nodes are renewed 7 days before expiration,base,ElastiCache Reserved Cache Node Lease Expiration In The Next 7 Days,ReservedCacheNodeLeaseExpirationIn7Days,resource,HIGH,NO,NO,NO,YES,NO,2017-01-01,2020-06-01,https://www.cloudconformity.com/knowledge-base/aws/EC/reserved-cache-node-lease-expiration-in-7-days.html,,,,
aws,EC-005,Ensure ElastiCache Reserved Cache Nodes are renewed 30 days before expiration,base,ElastiCache Reserved Cache Node Lease Expiration In The Next 30 Days,ReservedCacheNodeLeaseExpirationIn30Days,resource,MEDIUM,NO,NO,NO,YES,NO,2017-01-01,2020-06-01,https://www.cloudconformity.com/knowledge-base/aws/EC/reserved-cache-node-lease-expiration-in-30-days.html,,,,
aws,EC-006,Ensure ElastiCache Reserved Cache Nodes purchases have not failed,base,ElastiCache Reserved Cache Node Payment Failed,ReservedCacheNodePaymentFailed,resource,HIGH,NO,NO,NO,YES,NO,2017-01-01,2020-06-01,https://www.cloudconformity.com/knowledge-base/aws/EC/reserved-cache-node-payment-failed.html,,,,
aws,EC-007,Ensure ElastiCache Reserved Cache Nodes purchases are not pending,base,ElastiCache Reserved Cache Node Payment Pending,ReservedCacheNodePaymentPending,resource,HIGH,NO,NO,NO,YES,NO,2017-01-01,2020-06-01,https://www.cloudconformity.com/knowledge-base/aws/EC/reserved-cache-node-payment-pending.html,,,,
aws,EC-008,Ensure ElastiCache Reserved Cache Nodes purchases are regularly reviewed,base,ElastiCache Reserved Cache Node Recent Purchases,ReservedCacheNodeRecentPurchases,resource,LOW,NO,NO,NO,YES,NO,2017-01-01,2020-06-01,https://www.cloudconformity.com/knowledge-base/aws/EC/reserved-cache-node-recent-purchases.html,,,True,
aws,EC-009,Ensure that your ElastiCache Reserved Cache Nodes are being utilized,base,Unused ElastiCache Reserved Cache Nodes,ElastiCacheReservedCacheNodesUnused,cross-account,HIGH,NO,NO,NO,YES,NO,2017-01-01,2020-06-01,https://www.cloudconformity.com/knowledge-base/aws/EC/unused-reserved-cache-nodes.html,,,,
aws,EC-010,Ensure your AWS account has not reached the limit set for the number of ElastiCache cluster nodes,base,ElastiCache Nodes Counts,CacheNodeCounts,service,MEDIUM,YES,NO,NO,NO,NO,2017-01-01,2019-08-23,https://www.cloudconformity.com/knowledge-base/aws/EC/cache-node-counts.html,,,,
aws,EC-011,Ensure that all your Amazon ElastiCache cluster cache nodes are of given types,base,ElastiCache Desired Node Type,DesiredCacheNodeType,resource,MEDIUM,YES,NO,NO,NO,NO,2017-01-01,2019-08-23,https://www.cloudconformity.com/knowledge-base/aws/EC/desired-cache-node-type.html,,True,,
aws,EC-012,Ensure that AWS ElastiCache clusters are not using their default endpoint ports,base,ElastiCache Cluster Default Port,DefaultPort,resource,LOW,YES,NO,NO,NO,NO,2017-01-01,2019-08-23,https://www.cloudconformity.com/knowledge-base/aws/EC/default-port.html,,,,
aws,EC-013,Ensure that your Amazon ElastiCache clusters are using the stable latest version of Redis/Memcached cache engine,base,ElastiCache Engine Version,EngineVersion,resource,MEDIUM,YES,YES,YES,NO,NO,2017-01-01,2019-08-23,https://www.cloudconformity.com/knowledge-base/aws/EC/engine-version.html,,,,
aws,EC-014,Ensure that your AWS ElastiCache Redis clusters are encrypted in order to meet security and compliance requirements,base,ElastiCache Redis In-Transit and At-Rest Encryption,InTransitAndAtRestEncryption,resource,HIGH,YES,NO,NO,NO,NO,2017-01-01,2019-08-23,https://www.cloudconformity.com/knowledge-base/aws/EC/in-transit-and-at-rest-encryption.html,,,,
aws,EC-015,Identify any idle AWS ElastiCache nodes and terminate them in order to optimize your AWS costs.,base,Idle AWS ElastiCache Nodes,ElastiCacheIdleNode,resource,HIGH,NO,NO,NO,YES,NO,2020-06-01,2020-06-01,https://www.cloudconformity.com/knowledge-base/aws/EC/node-idle.html,,,,
aws,ES-001,Ensure Elasticsearch nodes are using General Purpose SSD storage instead of Provisioned IOPS SSD storage to optimize the service costs,base,Elasticsearch General Purpose SSD,ElasticsearchGeneralPurposeSSD,resource,MEDIUM,NO,NO,NO,YES,NO,2017-01-01,2020-06-01,https://www.cloudconformity.com/knowledge-base/aws/ES/general-purpose-ssd-volume.html,,,,
aws,ES-002,Ensure high availability for your Amazon Elasticsearch clusters by enabling the Zone Awareness feature,base,Elasticsearch Zone Awareness Enabled,ElasticsearchZoneAwarenessEnabled,resource,MEDIUM,NO,YES,NO,NO,NO,2017-01-01,2017-01-01,https://www.cloudconformity.com/knowledge-base/aws/ES/elasticsearch-zone-awareness-enabled.html,,,,
aws,ES-003,Ensure Amazon Elasticsearch Service (ES) domains are not exposed to everyone,base,Elasticsearch Domain Exposed,ElasticsearchDomainExposed,resource,HIGH,YES,NO,NO,NO,NO,2017-01-01,2018-05-23,https://www.cloudconformity.com/knowledge-base/aws/ES/elasticsearch-domain-exposed.html,,,,
aws,ES-004,Ensure Amazon Elasticsearch clusters are using dedicated master nodes to increase the production environment stability,base,Elasticsearch Dedicated Master Enabled,ElasticsearchDedicatedMasterEnabled,resource,MEDIUM,NO,YES,NO,NO,NO,2017-01-01,2017-01-01,https://www.cloudconformity.com/knowledge-base/aws/ES/elasticsearch-dedicated-master-enabled.html,,,,
aws,ES-005,Ensure Amazon Elasticsearch clusters do not allow unknown cross account access,base,Elasticsearch Cross Account Access,ElasticsearchCrossAccountAccess,resource,HIGH,YES,NO,NO,NO,NO,2017-01-01,2017-01-01,https://www.cloudconformity.com/knowledge-base/aws/ES/elasticsearch-cross-account-access.html,,,,
aws,ES-006,Ensure only safelisted IP addresses can access your Amazon Elasticsearch domains,base,Elasticsearch Accessible Only From Safelisted IP Addresses,ElasticsearchAccessibleOnlyFromSafelistedIPAddresses,resource,HIGH,YES,NO,NO,NO,NO,2017-01-01,2020-01-02,https://www.cloudconformity.com/knowledge-base/aws/ES/elasticsearch-accessible-only-from-safelisted-ip-addresses.html,,,,
aws,ES-007,Ensure that you always use the latest version of Elasticsearch engine for your AWS Elasticsearch domains,base,Elasticsearch Version,ElasticsearchVersion,resource,MEDIUM,YES,YES,YES,NO,NO,2017-01-01,2019-08-23,https://www.cloudconformity.com/knowledge-base/aws/ES/version.html,,,,
aws,ES-008,Ensure fewer AWS Elasticsearch cluster instances than provided limit in your AWS account,base,Elasticsearch Instance Counts,InstanceCounts,service,MEDIUM,YES,NO,NO,NO,NO,2017-01-01,2018-09-27,https://www.cloudconformity.com/knowledge-base/aws/ES/instance-counts.html,,,,
