provider,id,description,package,title,name,level,risk-level,security,reliability,performance-efficiency,cost-optimisation,operational-excellence,release-date,update-date,knowledge-base-html,multi-risk-level,must-be-configured,not-scored,categories
aws,Route53-008,Ensure that Sender Policy Framework (SPF) is used to stop spammers from spoofing your AWS Route 53 domain.,base,Sender Policy Framework In Use,SPFRecord,resource,MEDIUM,YES,NO,NO,NO,NO,2017-01-01,2020-11-10,https://www.cloudconformity.com/knowledge-base/aws/Route53/spf-in-use.html,,,,
aws,Route53-009,Monitor Route 53 configuration changes,rtm,Amazon Route 53 Configuration Changes,ServiceConfigurationChanges,event,HIGH,YES,NO,NO,NO,NO,2018-11-19,2017-01-01,https://www.cloudconformity.com/knowledge-base/aws/Route53/configuration-changes.html,,,,
aws,Route53-010,Ensure that Route 53 domains have Privacy Protection enabled,base,Privacy Protection,PrivacyProtection,resource,LOW,YES,NO,NO,NO,NO,2018-12-06,2017-01-01,https://www.cloudconformity.com/knowledge-base/aws/Route53/privacy-protection.html,,,,
aws,Route53-011,Ensure that Route 53 domains do not have any dangling DNS records,base,Dangling DNS Records,DanglingRecords,provider,MEDIUM,YES,NO,NO,NO,NO,2019-11-20,2020-12-18,https://www.cloudconformity.com/knowledge-base/aws/Route53/dangling-dns-records.html,,,,
aws,RDS-001,Ensure no DB security groups allow access from anywhere,base,Unrestricted DB Security Group,UnrestrictedDBSecurityGroup,resource,MEDIUM,YES,NO,NO,NO,NO,2017-01-01,2017-01-01,https://www.cloudconformity.com/knowledge-base/aws/RDS/unrestricted-db-security-group.html,,,,
aws,RDS-002,Ensure automated backups are enabled for RDS instances. This feature of Amazon RDS enables point-in-time recovery of your database instance,base,RDS Automated Backups Enabled,AutomatedBackupsEnabled,resource,HIGH,NO,YES,NO,NO,NO,2017-01-01,2017-01-01,https://www.cloudconformity.com/knowledge-base/aws/RDS/rds-automated-backups-enabled.html,,,,
aws,RDS-003,Ensure RDS instances have sufficient backup retention period for compliance purposes,base,RDS Sufficient Backup Retention Period,SufficientBackupRetentionPeriod,resource,MEDIUM,NO,YES,NO,NO,NO,2017-01-01,2018-09-27,https://www.cloudconformity.com/knowledge-base/aws/RDS/rds-sufficient-backup-retention-period.html,,,,
aws,RDS-004,Ensure encryption is setup for RDS instances to fulfill compliance requirements for data-at-rest encryption,base,RDS Encryption Enabled,EncryptionEnabled,resource,HIGH,YES,NO,NO,NO,NO,2017-01-01,2020-01-02,https://www.cloudconformity.com/knowledge-base/aws/RDS/rds-encryption-enabled.html,,,,
aws,RDS-005,Ensure RDS instances are encrypted with CMKs to have full control over encrypting and decrypting data,base,RDS Encrypted With KMS Customer Master Keys,RDSEncryptedWithCMK,resource,HIGH,YES,NO,NO,NO,NO,2017-01-01,2018-05-23,https://www.cloudconformity.com/knowledge-base/aws/RDS/rds-encrypted-with-kms-customer-master-keys.html,,,,
aws,RDS-006,Ensure Auto Minor Version Upgrade is enabled for RDS to automatically receive minor engine upgrades during the maintenance window,base,RDS Auto Minor Version Upgrade,AutoMinorVersionUpgrade,resource,MEDIUM,YES,NO,NO,NO,NO,2017-01-01,2017-01-01,https://www.cloudconformity.com/knowledge-base/aws/RDS/rds-auto-minor-version-upgrade.html,,,,
aws,RDS-007,Ensure RDS instances are launched into Multi-AZ,base,RDS Multi-AZ,MultiAZ,resource,MEDIUM,NO,YES,NO,NO,NO,2017-01-01,2019-01-17,https://www.cloudconformity.com/knowledge-base/aws/RDS/rds-multi-az.html,,,,
aws,RDS-008,Ensure RDS instances are not public facing to minimise security risks,base,RDS Publicly Accessible,PubliclyAccessible,resource,HIGH,YES,NO,NO,NO,NO,2017-01-01,2020-01-02,https://www.cloudconformity.com/knowledge-base/aws/RDS/rds-publicly-accessible.html,,,,
aws,RDS-009,Ensure you always use the latest generation of DB instances to get better performance with lower cost,base,DB Instance Generation,DBInstanceGeneration,resource,MEDIUM,NO,NO,YES,YES,NO,2017-01-01,2020-06-01,https://www.cloudconformity.com/knowledge-base/aws/RDS/db-instance-generation.html,,,,
aws,RDS-010,Ensure RDS instances are using General Purpose SSD storage instead of Provisioned IOPS SSD storage to optimize the RDS service costs,base,RDS General Purpose SSD,RDSGeneralPurposeSSD,resource,MEDIUM,NO,NO,NO,YES,NO,2017-01-01,2020-06-01,https://www.cloudconformity.com/knowledge-base/aws/RDS/general-purpose-ssd-storage-type.html,,,,
aws,RDS-011,Ensure Amazon RDS database instances are not using the default ports,base,RDS Default Port,RDSDefaultPort,resource,LOW,YES,NO,NO,NO,NO,2017-01-01,2017-01-01,https://www.cloudconformity.com/knowledge-base/aws/RDS/rds-default-port.html,,,,
aws,RDS-012,Ensure AWS RDS instances are using secure and unique master usernames for their databases,base,RDS Master Username,RDSMasterUsername,resource,LOW,YES,NO,NO,NO,NO,2017-01-01,2017-01-01,https://www.cloudconformity.com/knowledge-base/aws/RDS/rds-master-username.html,,,,
aws,RDS-013,Identify any Amazon RDS database instances that appear to be idle and delete them to help lower the cost of your monthly AWS bill,base,Idle RDS Instance,InstanceIdle,resource,HIGH,NO,NO,NO,YES,NO,2017-01-01,2020-06-01,https://www.cloudconformity.com/knowledge-base/aws/RDS/idle-instance.html,,,,
aws,RDS-014,Ensure RDS Reserved DB Instances are renewed 7 days before expiration,base,RDS Reserved DB Instance Lease Expiration In The Next 7 Days,ReservedDBInstanceLeaseExpirationIn7Days,resource,HIGH,NO,NO,NO,YES,NO,2017-01-01,2020-06-01,https://www.cloudconformity.com/knowledge-base/aws/RDS/reserved-instance-lease-expiration-in-7-days.html,,,,
aws,RDS-015,Ensure RDS Reserved DB Instances are renewed 30 days before expiration,base,RDS Reserved DB Instance Lease Expiration In The Next 30 Days,ReservedDBInstanceLeaseExpirationIn30Days,resource,MEDIUM,NO,NO,NO,YES,NO,2017-01-01,2020-06-01,https://www.cloudconformity.com/knowledge-base/aws/RDS/reserved-instance-lease-expiration-in-30-days.html,,,,
aws,RDS-016,Ensure RDS Reserved DB Instances purchases have not failed,base,RDS Reserved DB Instance Payment Failed,ReservedDBInstancePaymentFailed,resource,HIGH,NO,NO,NO,YES,NO,2017-01-01,2020-06-01,https://www.cloudconformity.com/knowledge-base/aws/RDS/reserved-instance-payment-failed.html,,,,
aws,RDS-017,Ensure RDS Reserved DB Instances purchases are not pending,base,RDS Reserved DB Instance Payment Pending,ReservedDBInstancePaymentPending,resource,HIGH,NO,NO,NO,YES,NO,2017-01-01,2020-06-01,https://www.cloudconformity.com/knowledge-base/aws/RDS/reserved-instance-payment-pending.html,,,,
aws,RDS-018,Ensure RDS Reserved DB Instances purchases are regularly reviewed,base,RDS Reserved DB Instance Recent Purchases,ReservedDBInstanceRecentPurchases,resource,LOW,NO,NO,NO,YES,NO,2017-01-01,2020-06-01,https://www.cloudconformity.com/knowledge-base/aws/RDS/reserved-instance-recent-purchases.html,,,True,
aws,RDS-019,Identify underutilized RDS instances and downsize them in order to optimize your AWS costs,base,Underutilized RDS Instance,UnderutilizedRDSInstance,resource,HIGH,NO,NO,NO,YES,NO,2017-01-01,2020-06-01,https://www.cloudconformity.com/knowledge-base/aws/RDS/underutilized-instance.html,,,,
aws,RDS-020,Ensure that your Amazon RDS Reserved Instances are being fully utilized,base,Unused RDS Reserved Instances,ReservedDBInstancesUnused,cross-account,HIGH,NO,NO,NO,YES,NO,2017-01-01,2020-06-01,https://www.cloudconformity.com/knowledge-base/aws/RDS/unused-reserved-instances.html,,,,
aws,RDS-021,Ensure that all database instances within an AWS Aurora cluster have the same accessibility,base,Aurora Database Instance Accessibility,AuroraInstanceAccessibility,service,MEDIUM,NO,YES,NO,NO,NO,2017-01-01,2017-01-01,https://www.cloudconformity.com/knowledge-base/aws/RDS/aurora-instance-accessibility.html,,,,
aws,RDS-022,Identify RDS instances with low free storage space and scale them in order to optimize their performance,base,RDS Free Storage Space,FreeStorageSpace,resource,HIGH,NO,NO,YES,NO,NO,2017-01-01,2018-09-27,https://www.cloudconformity.com/knowledge-base/aws/RDS/free-storage-space.html,,,,
aws,RDS-023,Ensure that your Amazon RDS database snapshots are not accessible to all AWS accounts,base,Amazon RDS Public Snapshots,PublicSnapshots,resource,HIGH,YES,NO,NO,NO,NO,2017-01-01,2020-06-30,https://www.cloudconformity.com/knowledge-base/aws/RDS/public-snapshots.html,,,,
aws,RDS-024,Ensure fewer Amazon RDS instances than the established limit in your AWS account,base,RDS Instance Counts,InstanceCounts,service,MEDIUM,YES,NO,NO,NO,NO,2017-01-01,2018-09-27,https://www.cloudconformity.com/knowledge-base/aws/RDS/db-instance-counts.html,,,,
aws,RDS-025,Ensure that all your AWS RDS database instances are of given instance types,base,RDS Desired Instance Type,DesiredDBInstanceType,resource,MEDIUM,YES,NO,NO,NO,NO,2017-01-01,2017-01-01,https://www.cloudconformity.com/knowledge-base/aws/RDS/desired-db-instance-type.html,,True,,
aws,RDS-026,Enable RDS Copy Tags to Snapshots,base,RDS Copy Tags to Snapshots,CopyTagsToSnapshot,resource,LOW,NO,NO,NO,YES,NO,2018-04-09,2021-02-25,https://www.cloudconformity.com/knowledge-base/aws/RDS/copy-tags-to-snapshot.html,,,,
aws,RDS-027,Enable Event Subscriptions for Instance Level Events,base,Instance Level Events Subscriptions,InstanceLevelEventsSubscriptions,service,LOW,NO,YES,YES,NO,YES,2018-08-20,2017-01-01,https://www.cloudconformity.com/knowledge-base/aws/RDS/rds-instance-level-events.html,,,,
aws,RDS-028,Enable Event Subscriptions for DB Security Groups Events,base,Security Groups Events Subscriptions,SecurityGroupsEventsSubscriptions,service,LOW,NO,YES,YES,NO,YES,2018-08-20,2017-01-01,https://www.cloudconformity.com/knowledge-base/aws/RDS/rds-db-security-groups-events.html,,,,
aws,RDS-029,Enable event notifications for RDS,base,RDS Event Notifications,EventsSubscriptions,service,LOW,NO,YES,YES,NO,YES,2018-10-08,2017-01-01,https://www.cloudconformity.com/knowledge-base/aws/RDS/notifications.html,,,,
aws,RDS-030,Enable IAM Database Authentication,base,IAM Database Authentication,IAMDatabaseAuthentication,resource,MEDIUM,YES,NO,NO,NO,NO,2018-12-06,2017-01-01,https://www.cloudconformity.com/knowledge-base/aws/RDS/iam-database-authentication.html,,,,
aws,RDS-031,Enable AWS RDS Instance Deletion Protection,base,Instance Deletion Protection,InstanceDeletionProtection,resource,MEDIUM,YES,NO,NO,NO,NO,2018-12-06,2019-06-03,https://www.cloudconformity.com/knowledge-base/aws/RDS/instance-deletion-protection.html,,,,
aws,RDS-032,Enable AWS RDS Performance Insights,base,Performance Insights,PerformanceInsights,resource,LOW,NO,YES,YES,NO,YES,2018-12-06,2017-01-01,https://www.cloudconformity.com/knowledge-base/aws/RDS/performance-insights.html,,,,
aws,RDS-033,Enable AWS RDS Log Exports,base,Log Exports,LogExports,resource,LOW,YES,YES,YES,NO,YES,2018-12-06,2017-01-01,https://www.cloudconformity.com/knowledge-base/aws/RDS/log-exports.html,,,,
aws,RDS-034,Enable Amazon Aurora Backtrack,base,Backtrack,Backtrack,resource,LOW,NO,YES,NO,NO,NO,2018-12-06,2017-01-01,https://www.cloudconformity.com/knowledge-base/aws/RDS/backtrack.html,,,,
aws,RDS-035,Enable AWS RDS Cluster Deletion Protection,base,Cluster Deletion Protection,ClusterDeletionProtection,resource,MEDIUM,YES,NO,NO,NO,NO,2019-06-03,2017-01-01,https://www.cloudconformity.com/knowledge-base/aws/RDS/cluster-deletion-protection.html,,,,
aws,RDS-036,Monitor AWS RDS Configuration Changes,rtm,RDS Configuration Changes,ServiceConfigurationChanges,event,HIGH,YES,NO,NO,NO,NO,2020-06-01,2017-01-01,https://www.cloudconformity.com/knowledge-base/aws/RDS/configuration-changes.html,,,,
aws,RDS-037,Ensure AWS RDS SQL Server and Postgre instances have Transport Encryption feature enabled.,base,Enable AWS RDS Transport Encryption,TransportEncryption,resource,HIGH,YES,NO,NO,NO,NO,2020-06-01,2017-01-01,https://www.cloudconformity.com/knowledge-base/aws/RDS/transport-encryption.html,,,,
aws,RDS-038,Identify overutilized RDS instances and upgrade them in order to optimize database workload and response time,base,Overutilized AWS RDS Instances,OverutilizedRDSInstance,resource,HIGH,NO,NO,YES,NO,NO,2020-06-30,2017-01-01,https://www.cloudconformity.com/knowledge-base/aws/RDS/overutilized-rds-instance.html,,,,
aws,RDS-039,Ensure that no AWS RDS database instances are provisioned inside VPC public subnets.,base,RDS Instance Not In Public Subnet,NotInPublicSubnet,service,HIGH,YES,NO,NO,NO,NO,2020-06-30,2020-09-21,https://www.cloudconformity.com/knowledge-base/aws/RDS/instance-not-in-public-subnet.html,,,,
aws,RDS-040,Ensure that AWS RDS snapshots are encrypted to meet security and compliance requirements,base,Enable RDS Snapshot Encryption,SnapshotEncrypted,resource,MEDIUM,YES,NO,NO,NO,NO,2020-07-30,2017-01-01,https://www.cloudconformity.com/knowledge-base/aws/RDS/snapshot-encrypted.html,,,,
aws,RDS-041,Ensure that RDS Storage AutoScaling feature is enabled to support unpredictable database workload,base,Enable Amazon RDS Storage AutoScaling,EnableRDSStorageAutoscaling,resource,MEDIUM,NO,NO,YES,NO,NO,2021-02-25,2017-01-01,https://www.cloudconformity.com/knowledge-base/aws/RDS/enable-rds-storage-autoscaling.html,,,,
aws,IAM-001,Ensure access keys are rotated every month to decrease the likelihood of accidental exposures,base,Access Keys Rotated 30 Days,AccessKeysRotated30Days,resource,LOW,YES,NO,NO,NO,NO,2017-01-01,2018-04-26,https://www.cloudconformity.com/knowledge-base/aws/IAM/access-keys-rotated-30-days.html,,,,
aws,IAM-002,Ensure access keys are not older than 45 days to decrease the likelihood of accidental exposures,base,Access Keys Rotated 45 Days,AccessKeysRotated45Days,resource,MEDIUM,YES,NO,NO,NO,NO,2017-01-01,2018-04-26,https://www.cloudconformity.com/knowledge-base/aws/IAM/access-keys-rotated-45-days.html,,,,
aws,IAM-003,Ensure credentials unused for 90 days or greater are disabled,base,Credentials Last Used,CredentialsLastUsed,resource,MEDIUM,YES,NO,NO,NO,NO,2017-01-01,2020-06-01,https://www.cloudconformity.com/knowledge-base/aws/IAM/credentials-last-used.html,,,,
aws,IAM-004,Ensure there is a maximum of one active access keys for any single user,base,Unnecessary Access Keys,AccessKeysUnnecessary,resource,MEDIUM,YES,NO,NO,NO,NO,2017-01-01,2017-01-01,https://www.cloudconformity.com/knowledge-base/aws/IAM/unnecessary-access-keys.html,,,,
aws,IAM-005,Ensure IAM password policy requires minimum length of 14 or greater,base,Password Policy Minimum Length,PasswordLength,resource,MEDIUM,YES,NO,NO,NO,NO,2017-01-01,2018-09-27,https://www.cloudconformity.com/knowledge-base/aws/IAM/password-policy.html,,,,
aws,IAM-006,Ensure account password policy is present. Strong password policy is vital to uphold security,base,Password Policy Present,PasswordPolicy,resource,HIGH,YES,NO,NO,NO,NO,2017-01-01,2020-07-30,https://www.cloudconformity.com/knowledge-base/aws/IAM/password-policy.html,,,,
aws,IAM-007,Ensure IAM password policy require at least one lowercase letter,base,Password Policy Lowercase,PasswordLowercase,resource,MEDIUM,YES,NO,NO,NO,NO,2017-01-01,2017-01-01,https://www.cloudconformity.com/knowledge-base/aws/IAM/password-policy.html,,,,
aws,IAM-008,Ensure IAM password policy requires at least one uppercase letter,base,Password Policy Uppercase,PasswordUppercase,resource,MEDIUM,YES,NO,NO,NO,NO,2017-01-01,2017-01-01,https://www.cloudconformity.com/knowledge-base/aws/IAM/password-policy.html,,,,
aws,IAM-009,Ensure IAM password policy require at least one number,base,Password Policy Number,PasswordNumber,resource,MEDIUM,YES,NO,NO,NO,NO,2017-01-01,2017-01-01,https://www.cloudconformity.com/knowledge-base/aws/IAM/password-policy.html,,,,
aws,IAM-010,Ensure IAM password policy require at least one symbol,base,Password Policy Symbol,PasswordNonAlphanumeric,resource,MEDIUM,YES,NO,NO,NO,NO,2017-01-01,2017-01-01,https://www.cloudconformity.com/knowledge-base/aws/IAM/password-policy.html,,,,
aws,IAM-011,Ensure IAM password policy expires passwords within 90 days or less,base,Password Policy Expiration,PasswordExpiration,resource,MEDIUM,YES,NO,NO,NO,NO,2017-01-01,2018-09-27,https://www.cloudconformity.com/knowledge-base/aws/IAM/password-policy.html,,,,
aws,IAM-012,Ensure IAM password policy prevents password reuse,base,Password Policy Reuse Prevention,PasswordReuse,resource,MEDIUM,YES,NO,NO,NO,NO,2017-01-01,2018-09-27,https://www.cloudconformity.com/knowledge-base/aws/IAM/password-policy.html,,,,
aws,IAM-013,Ensure multi-factor authentication (MFA) is enabled for all IAM users that have a console password,base,MFA For IAM Users With Console Password,MFAEnabled,resource,HIGH,YES,NO,NO,NO,NO,2017-01-01,2018-09-27,https://www.cloudconformity.com/knowledge-base/aws/IAM/iam-user-multi-factor-authentication-enabled.html,,,,
aws,IAM-014,Ensure MFA is enabled for the 'root' account,base,Root MFA Enabled,RootMFAEnabled,resource,HIGH,YES,NO,NO,NO,NO,2017-01-01,2018-05-23,https://www.cloudconformity.com/knowledge-base/aws/IAM/root-mfa-enabled.html,,,,
aws,IAM-015,Ensure no root account access key exists,base,Root Account Access Keys Present,RootAccessKeys,resource,HIGH,YES,NO,NO,NO,NO,2017-01-01,2018-04-26,https://www.cloudconformity.com/knowledge-base/aws/IAM/root-account-access-keys-present.html,,,,
aws,IAM-016,Ensure IAM policies are attached only to groups or roles,base,IAM User Policies,UserPolicies,resource,LOW,YES,NO,NO,NO,NO,2017-01-01,2017-01-01,https://www.cloudconformity.com/knowledge-base/aws/IAM/iam-user-policies.html,,,,
aws,IAM-017,Ensure all IAM groups have at least one user,base,Unused IAM Group,IAMGroupUnused,resource,LOW,YES,NO,NO,NO,NO,2017-01-01,2019-10-09,https://www.cloudconformity.com/knowledge-base/aws/IAM/unused-iam-group.html,,,,
aws,IAM-018,Ensure SSL/TLS certificates are renewed 7 days before expiration,base,SSL/TLS Certificate Expiry 7 Days,CertificateExpiry7Days,resource,HIGH,YES,NO,NO,NO,NO,2017-01-01,2020-06-01,https://www.cloudconformity.com/knowledge-base/aws/IAM/ssl-tls-certificate-expiry-7-days.html,,,,
aws,IAM-019,Ensure SSL/TLS certificates are renewed 30 days before expiration,base,SSL/TLS Certificate Expiry 30 Days,CertificateExpiry30Days,resource,MEDIUM,YES,NO,NO,NO,NO,2017-01-01,2020-06-01,https://www.cloudconformity.com/knowledge-base/aws/IAM/ssl-tls-certificate-expiry-30-days.html,,,,
aws,IAM-020,Ensure SSL/TLS certificates are renewed 45 days before expiration,base,SSL/TLS Certificate Expiry 45 Days,CertificateExpiry45Days,resource,LOW,YES,NO,NO,NO,NO,2017-01-01,2020-06-01,https://www.cloudconformity.com/knowledge-base/aws/IAM/ssl-tls-certificate-expiry-45-days.html,,,,
aws,IAM-021,Ensure expired certificates are removed,base,Expired SSL/TLS Certificate,CertificateExpired,resource,LOW,NO,YES,NO,NO,NO,2017-01-01,2020-06-01,https://www.cloudconformity.com/knowledge-base/aws/IAM/expired-ssl-tls-certificate.html,,,,
aws,IAM-022,Ensure IAM groups do not have inline policies attached,base,IAM Group With Inline Policies,GroupInlinePolicies,resource,MEDIUM,YES,NO,NO,NO,NO,2017-01-01,2017-01-01,https://www.cloudconformity.com/knowledge-base/aws/IAM/iam-group-with-inline-policies.html,,,,
aws,IAM-023,Ensure at least one IAM user has been created,base,IAM User Present,IAMUser,service,MEDIUM,YES,NO,NO,NO,NO,2017-01-01,2020-08-19,https://www.cloudconformity.com/knowledge-base/aws/IAM/iam-user-present.html,,,,
aws,IAM-024,Ensure IAM users have either API access or console access,base,IAM User With Password And Access Keys,IAMUserWithPasswordAndAccessKeys,resource,MEDIUM,YES,NO,NO,NO,NO,2017-01-01,2018-09-27,https://www.cloudconformity.com/knowledge-base/aws/IAM/iam-user-with-password-and-access-keys.html,,,,
aws,IAM-025,Ensure there is a maximum of one active SSH public keys for any single user,base,Unnecessary SSH Public Keys,SSHPublicKeysUnnecessary,resource,MEDIUM,YES,NO,NO,NO,NO,2017-01-01,2017-01-01,https://www.cloudconformity.com/knowledge-base/aws/IAM/unnecessary-ssh-public-keys.html,,,,
aws,IAM-026,Ensure SSH Public Keys are rotated every month to decrease the likelihood of accidental exposures,base,SSH Public Keys Rotated 30 Days,SSHPublicKeysRotated30Days,resource,LOW,YES,NO,NO,NO,NO,2017-01-01,2017-01-01,https://www.cloudconformity.com/knowledge-base/aws/IAM/ssh-public-keys-rotated-30-days.html,,,,
aws,IAM-027,Ensure SSH Public Keys are not older than 45 days to decrease the likelihood of accidental exposures,base,SSH Public Keys Rotated 45 Days,SSHPublicKeysRotated45Days,resource,MEDIUM,YES,NO,NO,NO,NO,2017-01-01,2017-01-01,https://www.cloudconformity.com/knowledge-base/aws/IAM/ssh-public-keys-rotated-45-days.html,,,,
aws,IAM-028,"Identify any inactive IAM users, who are not designed for API access, and disable their access as an extra security measure for protecting your AWS resources against unauthorized access",base,Inactive IAM Console User,IAMUserInactive,resource,MEDIUM,YES,NO,NO,NO,NO,2017-01-01,2018-09-27,https://www.cloudconformity.com/knowledge-base/aws/IAM/inactive-iam-user.html,,,,
aws,IAM-029,Ensure there are no users that have never been logged in,base,Unused IAM User,IAMUserUnused,resource,MEDIUM,YES,NO,NO,NO,NO,2017-01-01,2017-01-01,https://www.cloudconformity.com/knowledge-base/aws/IAM/unused-iam-user.html,,,,
aws,IAM-030,"Set up, organize and manage your AWS accounts for optimal security and manageability",base,AWS Multi-Account Centralized Management,MultiAccountCentralizedManagement,account,HIGH,YES,NO,NO,NO,NO,2017-01-01,2017-01-01,https://www.cloudconformity.com/knowledge-base/aws/IAM/aws-multi-account-centralized-management.html,,,True,
aws,IAM-031,Ensure security contact information is registered,base,Account Alternate Contacts,AccountAlternateContacts,account,HIGH,YES,NO,NO,NO,NO,2017-01-01,2017-01-01,https://www.cloudconformity.com/knowledge-base/aws/IAM/account-security-alternate-contacts.html,,,True,
aws,IAM-032,Ensure security questions are registered in the AWS account,base,Account Security Challenge Questions,AccountSecurityChallengeQuestions,account,HIGH,YES,NO,NO,NO,NO,2017-01-01,2017-01-01,https://www.cloudconformity.com/knowledge-base/aws/IAM/security-challenge-questions.html,,,True,
aws,IAM-033,Ensure that your server certificates are not vulnerable to Heartbleed security vulnerability,base,Pre-Heartbleed Server Certificates,CertificatePreHeartbleed,resource,HIGH,YES,NO,NO,NO,NO,2017-01-01,2020-06-01,https://www.cloudconformity.com/knowledge-base/aws/IAM/certificate-pre-heartbleed.html,,,,
aws,IAM-034,Ensure valid IAM Identity Providers are used within your AWS account for secure user authentication and authorization,base,Valid IAM Identity Providers,IdentityProvider,resource,HIGH,YES,NO,NO,NO,NO,2017-01-01,2017-01-01,https://www.cloudconformity.com/knowledge-base/aws/IAM/identity-provider.html,,,,
aws,IAM-035,Avoid the use of the 'root' account,base,Root Account Usage,RootAccountIsUsed,resource,HIGH,YES,NO,NO,NO,NO,2017-01-01,2020-04-08,https://www.cloudconformity.com/knowledge-base/aws/IAM/root-account-used-recently.html,,,,
aws,IAM-036,Ensure that there are no Amazon IAM users with administrator permissions,base,AWS IAM Users with Admin Privileges,IAMAdminPermissions,service,HIGH,YES,NO,NO,NO,NO,2019-01-17,2021-02-08,https://www.cloudconformity.com/knowledge-base/aws/IAM/admin-permissions.html,,,,
aws,IAM-037,Ensure IAM users that are not authorized to edit IAM access policies are decommissioned,base,IAM Users Unauthorized to Edit Access Policies,EditIAMPolicyPermission,service,HIGH,YES,NO,NO,NO,NO,2017-01-01,2020-10-14,https://www.cloudconformity.com/knowledge-base/aws/IAM/edit-iam-policy-permission.html,,,,
aws,IAM-038,Ensure access keys are rotated every 90 days or less,base,Access Keys Rotated 90 Days,AccessKeysRotated90Days,resource,HIGH,YES,NO,NO,NO,NO,2017-01-01,2018-04-26,https://www.cloudconformity.com/knowledge-base/aws/IAM/access-keys-rotated-90-days.html,,,,
aws,IAM-039,Ensure AWS IAM user passwords are reset before expiration (7 Days),base,IAM User Password Expiry 7 Days,PasswordExpiry7Days,resource,HIGH,YES,NO,NO,NO,NO,2017-01-01,2020-04-08,https://www.cloudconformity.com/knowledge-base/aws/IAM/password-expiry-in-7-days.html,,,,
aws,IAM-040,Ensure AWS IAM user passwords are reset before expiration (30 Days),base,IAM User Password Expiry 30 Days,PasswordExpiry30Days,resource,MEDIUM,YES,NO,NO,NO,NO,2017-01-01,2020-04-08,https://www.cloudconformity.com/knowledge-base/aws/IAM/password-expiry-in-30-days.html,,,,
aws,IAM-041,Ensure AWS IAM user passwords are reset before expiration (45 Days),base,IAM User Password Expiry 45 Days,PasswordExpiry45Days,resource,LOW,YES,NO,NO,NO,NO,2017-01-01,2020-04-08,https://www.cloudconformity.com/knowledge-base/aws/IAM/password-expiry-in-45-days.html,,,,
aws,IAM-042,Ensure hardware MFA is enabled for the 'root' account,base,Hardware MFA for AWS Root Account,RootHardwareMFA,service,HIGH,YES,NO,NO,NO,NO,2017-01-01,2020-09-21,https://www.cloudconformity.com/knowledge-base/aws/IAM/root-hardware-mfa.html,,,,
aws,IAM-043,Do not setup access keys during initial user setup for all IAM users that have a console password,base,Access Keys During Initial IAM User Setup,AccessKeysDuringInitialIAMUserSetup,account,MEDIUM,YES,NO,NO,NO,NO,2017-01-01,2017-01-01,https://www.cloudconformity.com/knowledge-base/aws/IAM/access-keys-during-initial-iam-user-setup.html,,,True,
aws,IAM-044,Ensure SSH Public Keys are not older than 90 days to decrease the likelihood of accidental exposures,base,SSH Public Keys Rotated 90 Days,SSHPublicKeysRotated90Days,resource,HIGH,YES,NO,NO,NO,NO,2017-01-01,2017-01-01,https://www.cloudconformity.com/knowledge-base/aws/IAM/ssh-public-keys-rotated-90-days.html,,,,
